{"checks":[{"id":"OBSERVED_SOURCE_TREE_CLEAN","result":"PASS"},{"id":"OBSERVED_ARTIFACT_HASHES","result":"PASS"},{"id":"DEBIAN_13_AMD64_X86_64_SYSTEMD_257_VM","result":"PASS"},{"id":"INITIAL_INVOCATION_BOUND","result":"PASS"},{"id":"INITIAL_ARGUMENTLESS_PRODUCTION_BOUNDARY","result":"PASS"},{"id":"SINGLETON_RELAY_MAY_OWN_CUSTODY_EXACT_PRESENT","result":"PASS"},{"id":"FIRST_CRASH_AT_PUBLISHED_TERMINAL_GUARD","result":"PASS"},{"id":"FIRST_FORCED_HELPER_SIGKILL_OBSERVED","result":"PASS"},{"id":"FIRST_SYSTEMD_FDSTORE_EXACT_CUSTODY_PRESERVED","result":"PASS"},{"id":"SECOND_DISTINCT_ARGUMENTLESS_INVOCATION_BOUND","result":"PASS"},{"id":"SECOND_INHERITED_SINGLETON_MAY_OWN_EXACT_PRESENT","result":"PASS"},{"id":"REAPER_CLEANUP_EVIDENCE_REACHED_JOURNAL_BOUNDARY","result":"PASS"},{"id":"SECOND_FORCED_HELPER_SIGKILL_OBSERVED","result":"PASS"},{"id":"SECOND_SYSTEMD_FDSTORE_EXACT_CUSTODY_PRESERVED","result":"PASS"},{"id":"THIRD_DISTINCT_ARGUMENTLESS_INVOCATION_BOUND","result":"PASS"},{"id":"THIRD_INHERITED_SINGLETON_MAY_OWN_EXACT_PRESENT","result":"PASS"},{"id":"CLEANUP_CONFIRMED_BEFORE_MANAGER_REMOVAL","result":"PASS"},{"id":"STARTUP_REMOVAL_CALL_OBSERVED","result":"PASS"},{"id":"MANAGER_FDSTORE_ZERO_AFTER_REMOVAL","result":"PASS"},{"id":"JOURNAL_ABSENT_RECOVERED_MAY_OWN","result":"PASS"},{"id":"SOCKET_PUBLISHED_ONLY_AFTER_SETTLEMENT","result":"PASS"},{"id":"RECOVERED_UNIT_RETIRED_NOT_FOUND","result":"PASS"},{"id":"RETIREMENT_LOCK_RELEASED","result":"PASS"},{"id":"RETIREMENT_SOCKET_ABSENT","result":"PASS"},{"id":"ENUMERATED_HOST_STATE_EQUAL_AT_FENCES","result":"PASS"}],"enumerated_host_state":{"after_sha256":"1111111111111111111111111111111111111111111111111111111111111111","before_sha256":"1111111111111111111111111111111111111111111111111111111111111111","equal_at_fences":true,"records":["production_runtime_path","accounts","namespaces","mounts","resolver","sysctls","links","addresses","routes","rules","nexthops","qdiscs","nftables","wireguard","legacy_ipv4_firewall","legacy_ipv6_firewall"]},"environment":{"debian_version":"13","dpkg_architecture":"amd64","kernel_release":"6.12.43+deb13-amd64","machine":"x86_64","systemd_version":257,"virtualization":"vm"},"finished_at":"2026-08-30T12:00:08Z","generated_at":"2026-08-30T12:00:09Z","invocation_ids":["11111111111111111111111111111111","22222222222222222222222222222222","33333333333333333333333333333333"],"observed_artifact_hashes":{"debugger_sha256":"5555555555555555555555555555555555555555555555555555555555555555","may_own_observer_sha256":"4444444444444444444444444444444444444444444444444444444444444444","production_ipc_probe_sha256":"2222222222222222222222222222222222222222222222222222222222222222","production_ipc_unit_hook_sha256":"3333333333333333333333333333333333333333333333333333333333333333","volparossa_helper_sha256":"1111111111111111111111111111111111111111111111111111111111111111"},"observed_source":{"commit_sha":"1111111111111111111111111111111111111111","worktree_clean":true},"overall":"PASS","report_kind":"volparossa-helper-restart-may-own-custody-relay-evidence","restart":{"crashes":[{"boundary":"worker_v3::DurableCustodyPublicationTerminalGuard::retain_published","crashed_at":"2026-08-30T12:00:02Z","exec_main_code":2,"exec_main_status":9,"journal_phase_after_crash":"MayOwnCustody","manager_fdstore_after_crash":2,"sequence":1,"signal":"SIGKILL","unit_result":"signal"},{"boundary":"ownership_journal::actor::DurableOwnershipStartup::confirm_single_restart_cleanup","boundary_observed_at":"2026-08-30T12:00:03Z","crashed_at":"2026-08-30T12:00:04Z","exec_main_code":2,"exec_main_status":9,"journal_phase_after_crash":"MayOwnCustody","manager_fdstore_after_crash":2,"sequence":2,"signal":"SIGKILL","unit_result":"signal"}],"initial":{"argumentless":true,"manager_fdstore_count":2,"publication_boundary":"worker_v3::DurableCustodyPublicationTerminalGuard::retain_published","publication_observed_at":"2026-08-30T12:00:01Z","target_count":1,"target_disposition":"ExactPresent","target_phase":"MayOwnCustody","target_role":"Relay"},"recovered":{"argumentless":true,"cleanup_confirmed_before_removal":true,"inherited_descriptor_count":2,"journal_absent_origin":"RecoveredMayOwn","journal_phase_after_settlement":"Absent","manager_fdstore_after_removal":0,"new_socket_published_after_settlement":true,"new_socket_published_before_settlement":false,"removal_boundary":"systemd_fdstore::remove_restart_custody","removal_observed_at":"2026-08-30T12:00:05Z","settled_at":"2026-08-30T12:00:06Z","target_count":1,"target_role":"Relay","unit_load_state_after_retirement":"not-found"}},"retirement":{"journal_settled_absent":true,"lock_released":true,"socket_absent":true},"schema_version":1,"scope":{"acceptance_a01_a15":false,"cleanup_owned":false,"forced_helper_crash_count":2,"general_restart_recovery":false,"helper_boundary_only":true,"installed_package":false,"may_own_custody_exact_present_singleton_relay":true,"usable_datapath":false},"started_at":"2026-08-30T12:00:00Z"}
